{
  "advertised_profile": "actor",
  "baseline": "0.1",
  "candidate": "trealla",
  "counts": {
    "diagnostic_error": 0,
    "fail": 0,
    "observed": 0,
    "pass": 6,
    "unsupported": 0
  },
  "duration_ms": 793,
  "endpoint": "ws://127.0.0.1:52631/ws",
  "peer": null,
  "results": [
    {
      "duration_ms": 140,
      "id": "CV-001",
      "observation": {
        "data": [
          {
            "BaselineResult": "passed",
            "CVOptions1": "[unknown(creation_probe)]",
            "CVSelf": "2746829096@'http://127.0.0.1:52631'",
            "E": "error(domain_error(spawn_option,unknown(creation_probe)),context(actors:spawn/3,'invalid spawn option'))",
            "P": "P"
          }
        ],
        "more": false,
        "pid": 2746829096,
        "type": "success"
      },
      "status": "pass",
      "title": "Unknown spawn options identify the option family"
    },
    {
      "duration_ms": 125,
      "id": "CV-002",
      "observation": {
        "data": [
          {
            "BaselineResult": "passed",
            "CVOptions1": "[monitor(true)|bad]",
            "CVOptions2": "[_]",
            "CVSelf": "1540918963@'http://127.0.0.1:52631'",
            "E1": "error(instantiation_error,context(actors:spawn/3,'invalid spawn option'))",
            "E2": "error(type_error(list,[monitor(true)|bad]),context(actors:spawn/3,'invalid spawn option'))",
            "E3": "error(instantiation_error,context(actors:spawn/3,'invalid spawn option'))",
            "Option": "Option",
            "Options": "Options",
            "P": "P",
            "Q": "Q",
            "R": "R"
          }
        ],
        "more": false,
        "pid": 1540918963,
        "type": "success"
      },
      "status": "pass",
      "title": "Option lists and entries must be instantiated and proper"
    },
    {
      "duration_ms": 119,
      "id": "CV-003",
      "observation": {
        "data": [
          {
            "BaselineResult": "passed",
            "CVOptions1": "[link(maybe)]",
            "CVOptions2": "[monitor(1)]",
            "CVOptions3": "[node(42)]",
            "CVSelf": "1507689707@'http://127.0.0.1:52631'",
            "E1": "error(type_error(boolean,maybe),context(actors:spawn/3,'invalid spawn option'))",
            "E2": "error(type_error(boolean,1),context(actors:spawn/3,'invalid spawn option'))",
            "E3": "error(type_error(atom_or_string,42),context(actors:spawn/3,'invalid spawn option'))",
            "P": "P",
            "Q": "Q",
            "R": "R"
          }
        ],
        "more": false,
        "pid": 1507689707,
        "type": "success"
      },
      "status": "pass",
      "title": "Boolean and node values reject invalid types"
    },
    {
      "duration_ms": 126,
      "id": "CV-004",
      "observation": {
        "data": [
          {
            "BaselineResult": "passed",
            "CVOptions1": "[session(true),session(maybe)]",
            "CVOptions2": "[link(true),link(maybe)]",
            "CVOptions3": "[period(1),period(0)]",
            "CVSelf": "1839118068@'http://127.0.0.1:52631'",
            "E1": "error(type_error(boolean,maybe),context(actors:spawn/3,'invalid spawn option'))",
            "E2": "error(type_error(boolean,maybe),context(toplevel_actors:toplevel_spawn/2,'invalid wrapper option'))",
            "E3": "error(domain_error(supervisor_period,0),context(supervisor_actor:supervisor_spawn/3,'invalid wrapper option'))",
            "P": "P",
            "Sup": "Sup",
            "T": "T"
          }
        ],
        "more": false,
        "pid": 1839118068,
        "type": "success"
      },
      "status": "pass",
      "title": "Later duplicate occurrences are validated"
    },
    {
      "duration_ms": 147,
      "id": "CV-005",
      "observation": {
        "data": [
          {
            "A": "success(1790063442,[true],false)",
            "BaselineResult": "passed",
            "CVOptions1": "[timeout(2),on_timeout(throw(first_session_setting_not_preserved))]",
            "CVOptions2": "[strategy(one_for_one),intensity(0),period(0.25),monitor(true)]",
            "CVOptions3": "[timeout(2),on_timeout(throw(missing_supervisor_down))]",
            "CVOptions4": "[timeout(2),on_timeout(throw(missing_wrapper_answer))]",
            "CVOptions5": "[session(false),session(true),monitor(true)]",
            "CVOptions6": "[strategy(one_for_one)]",
            "CVOptions7": "[session(false)]",
            "CVSelf": "1077386457@'http://127.0.0.1:52631'",
            "Children": "[]",
            "E1": "error(domain_error(spawn_option,session(false)),context(actors:spawn/3,'invalid spawn option'))",
            "E2": "error(domain_error(spawn_option,strategy(one_for_one)),context(actors:spawn/3,'invalid spawn option'))",
            "P": "P",
            "Q": "Q",
            "Sup": "1704880293",
            "T": "1790063442"
          }
        ],
        "more": false,
        "pid": 1077386457,
        "type": "success"
      },
      "status": "pass",
      "title": "Wrapper-only options are separated and first scalar setting wins"
    },
    {
      "duration_ms": 136,
      "id": "CV-006",
      "observation": {
        "data": [
          {
            "BaselineResult": "passed",
            "CVOptions1": "[src_uri('file:///definitely-missing-creation-validation.pl'),unknown(creation_probe)]",
            "CVOptions2": "[timeout(2),on_timeout(throw(missing_valid_start))]",
            "CVOptions3": "[timeout(2),on_timeout(throw(missing_valid_down))]",
            "CVOptions4": "[timeout(0),on_timeout(true)]",
            "CVOptions5": "[monitor(true)]",
            "CVSelf": "2365839271@'http://127.0.0.1:52631'",
            "E": "error(domain_error(spawn_option,unknown(creation_probe)),context(actors:spawn/3,'invalid spawn option'))",
            "P": "1824524369",
            "Rejected": "Rejected",
            "S": "2365839271@'http://127.0.0.1:52631'"
          }
        ],
        "more": false,
        "pid": 2365839271,
        "type": "success"
      },
      "status": "pass",
      "title": "Validation precedes source loading and application activation"
    }
  ],
  "schema_version": 2,
  "scope": "required",
  "started_at": "2026-10-24T18:17:31.462359+00:00",
  "suite": "creation-validation-0.1"
}
