{
  "advertised_profile": "actor",
  "baseline": "0.1",
  "candidate": "trealla",
  "counts": {
    "diagnostic_error": 0,
    "fail": 0,
    "observed": 0,
    "pass": 3,
    "unsupported": 0
  },
  "duration_ms": 137,
  "endpoint": "ws://127.0.0.1:61012/ws",
  "peer": "http://127.0.0.1:61005",
  "results": [
    {
      "duration_ms": 53,
      "id": "IX-001",
      "observation": {
        "data": [
          {
            "A": "success(2002316317@'http://127.0.0.1:61005',[a],true)",
            "B": "success(2002316317@'http://127.0.0.1:61005',[b],false)",
            "BaselineResult": "passed",
            "P": "2002316317@'http://127.0.0.1:61005'",
            "X": "X"
          }
        ],
        "more": false,
        "pid": 2659876127,
        "type": "success"
      },
      "status": "pass",
      "title": "Remote source, synchronous paging and spawn monitor"
    },
    {
      "duration_ms": 41,
      "id": "IX-002",
      "observation": {
        "data": [
          {
            "A": "A",
            "B": "A",
            "BaselineResult": "passed",
            "P": "9325675910@'http://127.0.0.1:61005'",
            "V": "V"
          }
        ],
        "more": false,
        "pid": 2659960162,
        "type": "success"
      },
      "status": "pass",
      "title": "Canonical asynchronous answers preserve shared variables and quoted atoms"
    },
    {
      "duration_ms": 43,
      "id": "IX-003",
      "observation": {
        "data": [
          {
            "A": "success(2280441470@'http://127.0.0.1:61005',[true],false)",
            "BaselineResult": "passed",
            "Other": "2660027390",
            "P": "2280441470@'http://127.0.0.1:61005'",
            "S": "2660010583@'http://127.0.0.1:61012'"
          }
        ],
        "more": false,
        "pid": 2660010583,
        "type": "success"
      },
      "status": "pass",
      "title": "Remote calls preserve an unrelated local monitor and message"
    }
  ],
  "schema_version": 2,
  "scope": "required",
  "started_at": "2026-10-21T10:43:14.954800+00:00",
  "suite": "interop-actor-0.1"
}
