{
  "advertised_profile": "actor",
  "baseline": "0.1",
  "candidate": "trealla",
  "counts": {
    "diagnostic_error": 0,
    "fail": 0,
    "observed": 0,
    "pass": 2,
    "unsupported": 0
  },
  "duration_ms": 257,
  "endpoint": "http://127.0.0.1:50724",
  "peer": "http://127.0.0.1:50717",
  "results": [
    {
      "duration_ms": 129,
      "id": "HC-001",
      "observation": [
        {
          "body": "success([[a,b,c]],false).\n",
          "http_status": 200
        }
      ],
      "status": "pass",
      "title": "RPC preserves all pages"
    },
    {
      "duration_ms": 127,
      "id": "HC-002",
      "observation": [
        {
          "body": "success([ok],false).\n",
          "http_status": 200
        }
      ],
      "status": "pass",
      "title": "Promise preserves template sharing and caller independence"
    }
  ],
  "schema_version": 2,
  "scope": "required",
  "started_at": "2026-10-24T16:21:10.832653+00:00",
  "suite": "interop-http-0.1"
}
