{
  "advertised_profile": "actor",
  "baseline": "0.1",
  "candidate": "trealla",
  "counts": {
    "diagnostic_error": 1,
    "fail": 0,
    "observed": 5,
    "pass": 0,
    "unsupported": 0
  },
  "duration_ms": 10022,
  "endpoint": "http://127.0.0.1:64438",
  "peer": null,
  "results": [
    {
      "duration_ms": 7,
      "id": "IBD-001",
      "issue": "GNU ISOBASE D01/K01; no zero-limit decision is made by this baseline",
      "observation": [
        {
          "body": "error(error(domain_error(limit,0),resource_policy)).\n",
          "http_status": 200
        }
      ],
      "status": "observed",
      "title": "Zero limit remains a recorded GNU/shared-contract difference"
    },
    {
      "duration_ms": 4,
      "id": "IBD-002",
      "issue": "GNU ISOBASE contract 0.2.0 B01: normative in that draft, not waived by this scoped baseline",
      "observation": [
        {
          "body": "success([ok],false).\n",
          "http_status": 200
        }
      ],
      "status": "observed",
      "title": "ISO power result type vs SWI arithmetic extension"
    },
    {
      "duration_ms": 4,
      "id": "IBD-003",
      "issue": "Portable Text 0.1 remains experimental",
      "observation": [
        {
          "body": "success([ok],false).\n",
          "http_status": 200
        }
      ],
      "status": "observed",
      "title": "Double-quoted character-list experiment"
    },
    {
      "duration_ms": 1,
      "id": "IBD-004",
      "issue": "Record response/status without freezing a new HTTP status rule",
      "observation": [
        {
          "body": "error(error(syntax_error(start_expected),read_term_from_atom/3)).\n",
          "http_status": 200
        }
      ],
      "status": "observed",
      "title": "Malformed goal error and HTTP status"
    },
    {
      "duration_ms": 4,
      "id": "IBD-005",
      "issue": "GNU ISOBASE numeric/text reconciliation retains authority for its requirements",
      "observation": [
        {
          "body": "success([rejected(error(type_error(atom,42),atom_length/2))],false).\n",
          "http_status": 200
        }
      ],
      "status": "observed",
      "title": "Numeric conversion type/error boundary"
    },
    {
      "detail": "timeout: timed out",
      "duration_ms": 10001,
      "id": "IBD-006",
      "issue": "Record operator-framing differences; baseline requests frame goal and template in parentheses on every candidate",
      "status": "diagnostic_error",
      "title": "Unparenthesized operator goal in flat HTTP parameters"
    }
  ],
  "schema_version": 2,
  "scope": "diagnostic",
  "started_at": "2026-10-23T10:09:58.516931+00:00",
  "suite": "isobase-diagnostics-0.1"
}
