{
  "advertised_profile": "actor",
  "baseline": "0.1",
  "candidate": "swi",
  "counts": {
    "diagnostic_error": 0,
    "fail": 0,
    "observed": 0,
    "pass": 6,
    "unsupported": 0
  },
  "duration_ms": 415,
  "endpoint": "ws://127.0.0.1:51605/ws",
  "peer": null,
  "results": [
    {
      "duration_ms": 90,
      "id": "TW-001",
      "observation": {
        "data": [
          {
            "A": "success(3828276837@'http://127.0.0.1:51605',[ok],false)",
            "BaselineResult": "passed",
            "E": "error(domain_error(synchronous_toplevel_target,other),context(toplevel_actors:toplevel_call_synch/4,'invalid synchronous toplevel option'))",
            "P": "3828276837@'http://127.0.0.1:51605'",
            "S": "3151877890@'http://127.0.0.1:51605'",
            "X": "X"
          }
        ],
        "more": false,
        "pid": 3151877890,
        "type": "success"
      },
      "status": "pass",
      "title": "Caller targeting and independent query variables"
    },
    {
      "duration_ms": 80,
      "id": "TW-002",
      "observation": {
        "data": [
          {
            "A": "A",
            "B": "success(6751046164@'http://127.0.0.1:51605',[true],false)",
            "Barrier": "success(6751046164@'http://127.0.0.1:51605',[true],false)",
            "BaselineResult": "passed",
            "C": "success(6751046164@'http://127.0.0.1:51605',[true],false)",
            "D": "success(6751046164@'http://127.0.0.1:51605',[true],false)",
            "E": "tw_callback",
            "Me": "Me",
            "P": "6751046164@'http://127.0.0.1:51605'",
            "S": "6643626868@'http://127.0.0.1:51605'",
            "V": "V",
            "Vs": "[first]"
          }
        ],
        "more": false,
        "pid": 6643626868,
        "type": "success"
      },
      "status": "pass",
      "title": "Timeout outcome and callback bindings failure exceptions and commitment"
    },
    {
      "duration_ms": 76,
      "id": "TW-003",
      "observation": {
        "data": [
          {
            "A": "success(5084444058@'http://127.0.0.1:51605',[fresh],false)",
            "BaselineResult": "passed",
            "Early": "Early",
            "First": "success(5084444058@'http://127.0.0.1:51605',[a],true)",
            "Last": "success(5084444058@'http://127.0.0.1:51605',[c],false)",
            "Late": "Late",
            "Me": "Me",
            "Me2": "Me2",
            "P": "5084444058@'http://127.0.0.1:51605'",
            "S": "9192066963@'http://127.0.0.1:51605'",
            "X": "X"
          }
        ],
        "more": false,
        "pid": 9192066963,
        "type": "success"
      },
      "status": "pass",
      "title": "Late timed-out answer cannot satisfy the next synchronous wait"
    },
    {
      "duration_ms": 74,
      "id": "TW-004",
      "observation": {
        "data": [
          {
            "A": "success(4068601196@'http://127.0.0.1:51605',[c,d],false)",
            "BaselineResult": "passed",
            "P": "4068601196@'http://127.0.0.1:51605'",
            "X": "X"
          }
        ],
        "more": false,
        "pid": 2706725658,
        "type": "success"
      },
      "status": "pass",
      "title": "Output mismatch consumes selected slice and continuation advances"
    },
    {
      "duration_ms": 22,
      "id": "TW-005",
      "observation": {
        "data": [
          {
            "BaselineResult": "passed",
            "E": "toplevel_down(tw_death)",
            "P": "5746302937@'http://127.0.0.1:51605'",
            "R": "5798711243"
          }
        ],
        "more": false,
        "pid": 3958929926,
        "type": "success"
      },
      "status": "pass",
      "title": "Termination during wait preserves independent and spawn monitors"
    },
    {
      "duration_ms": 73,
      "id": "TW-006",
      "observation": {
        "data": [
          {
            "A": "success(6208658652@'http://127.0.0.1:51605',[sync],false)",
            "BaselineResult": "passed",
            "P": "6208658652@'http://127.0.0.1:51605'",
            "R": "8604748701",
            "S": "3918333636@'http://127.0.0.1:51605'"
          }
        ],
        "more": false,
        "pid": 3918333636,
        "type": "success"
      },
      "status": "pass",
      "title": "Synchronous wait preserves asynchronous answers and unrelated messages"
    }
  ],
  "schema_version": 2,
  "scope": "required",
  "started_at": "2026-10-24T17:22:41.323953+00:00",
  "suite": "toplevel-waits-0.1"
}
