{
  "advertised_profile": "actor",
  "baseline": "0.1",
  "candidate": "trealla",
  "counts": {
    "diagnostic_error": 0,
    "fail": 0,
    "observed": 0,
    "pass": 6,
    "unsupported": 0
  },
  "duration_ms": 2586,
  "endpoint": "ws://127.0.0.1:61916/ws",
  "peer": "http://127.0.0.1:61916",
  "results": [
    {
      "duration_ms": 733,
      "id": "PY-001",
      "observation": {
        "data": [
          {
            "A": "success([ok],false)",
            "BaselineResult": "passed",
            "Early": "timeout",
            "R": "1000000148",
            "X": "X"
          }
        ],
        "more": false,
        "pid": 2936122972,
        "type": "success"
      },
      "status": "pass",
      "title": "Default timeout preserves the promise for retry"
    },
    {
      "duration_ms": 738,
      "id": "PY-002",
      "observation": {
        "data": [
          {
            "A": "success([ok],false)",
            "BaselineResult": "passed",
            "Early": "waiting",
            "R": "1000000164",
            "S": "3085338356@'http://127.0.0.1:61916'",
            "X": "X"
          }
        ],
        "more": false,
        "pid": 3085338356,
        "type": "success"
      },
      "status": "pass",
      "title": "Timeout callback runs once and preserves retry and unrelated data"
    },
    {
      "duration_ms": 245,
      "id": "PY-003",
      "observation": {
        "data": [
          {
            "A": "success([a,b],false)",
            "BaselineResult": "passed",
            "R": "1000000180",
            "X": "X"
          }
        ],
        "more": false,
        "pid": 2118355650,
        "type": "success"
      },
      "status": "pass",
      "title": "Once returns the complete first slice without continuation"
    },
    {
      "duration_ms": 369,
      "id": "PY-004",
      "observation": {
        "data": [
          {
            "A": "failure",
            "B": "error(promise_probe_error)",
            "BaselineResult": "passed",
            "R": "1000000196",
            "R2": "1000000204"
          }
        ],
        "more": false,
        "pid": 2375298238,
        "type": "success"
      },
      "status": "pass",
      "title": "Logical failure and remote exceptions arrive as distinct answers"
    },
    {
      "duration_ms": 250,
      "id": "PY-005",
      "observation": {
        "data": [
          {
            "A": "success([true],false)",
            "BaselineResult": "passed",
            "E": "error(existence_error(promise,1000000220),context(rpc:yield/3,'unknown, consumed, or expired promise'))",
            "E2": "error(existence_error(promise,1000000221),context(rpc:yield/3,'unknown, consumed, or expired promise'))",
            "Missing": "1000000220",
            "R": "1000000221"
          }
        ],
        "more": false,
        "pid": 1196422507,
        "type": "success"
      },
      "status": "pass",
      "title": "Unknown and collected references raise the documented existence error"
    },
    {
      "duration_ms": 250,
      "id": "PY-006",
      "observation": {
        "data": [
          {
            "A": "success([ok],false)",
            "BaselineResult": "passed",
            "E": "error(type_error(number,bad),context(rpc:yield/3,'invalid client option'))",
            "R": "1000000237",
            "X": "X"
          }
        ],
        "more": false,
        "pid": 2093587738,
        "type": "success"
      },
      "status": "pass",
      "title": "Invalid wait options do not consume the promise"
    }
  ],
  "schema_version": 2,
  "scope": "required",
  "started_at": "2026-10-24T20:05:18.895150+00:00",
  "suite": "promise-yield-0.1"
}
