{
  "advertised_profile": "isobase",
  "baseline": "0.1",
  "candidate": "gnu",
  "counts": {
    "diagnostic_error": 0,
    "fail": 0,
    "observed": 0,
    "pass": 10,
    "unsupported": 0
  },
  "duration_ms": 128,
  "endpoint": "http://127.0.0.1:57367",
  "peer": null,
  "results": [
    {
      "duration_ms": 21,
      "id": "IB-001",
      "observation": [
        {
          "body": "success([ok],false).\n",
          "http_status": 200
        }
      ],
      "status": "pass",
      "title": "Deterministic success"
    },
    {
      "duration_ms": 10,
      "id": "IB-002",
      "observation": [
        {
          "body": "failure.\n",
          "http_status": 200
        }
      ],
      "status": "pass",
      "title": "Logical failure"
    },
    {
      "duration_ms": 11,
      "id": "IB-003",
      "observation": [
        {
          "body": "success([a,b],true).\n",
          "http_status": 200
        },
        {
          "body": "success([c],false).\n",
          "http_status": 200
        }
      ],
      "status": "pass",
      "title": "Paged enumeration and final-page state"
    },
    {
      "duration_ms": 10,
      "id": "IB-004",
      "observation": [
        {
          "body": "success([b],false).\n",
          "http_status": 200
        }
      ],
      "status": "pass",
      "title": "Offset and once stop at the requested slice"
    },
    {
      "duration_ms": 11,
      "id": "IB-005",
      "observation": [
        {
          "body": "error(baseline_probe).\n",
          "http_status": 200
        }
      ],
      "status": "pass",
      "title": "Uncaught exception is an error answer"
    },
    {
      "duration_ms": 11,
      "id": "IB-006",
      "observation": [
        {
          "body": "success([a,b],false).\n",
          "http_status": 200
        }
      ],
      "status": "pass",
      "title": "Supplied source executes in the request"
    },
    {
      "duration_ms": 10,
      "id": "IB-007",
      "observation": [
        {
          "body": "success([pair(_A0_V0,_A0_V0)],false).\n",
          "http_status": 200
        }
      ],
      "status": "pass",
      "title": "Prolog template preserves variable sharing"
    },
    {
      "duration_ms": 11,
      "id": "IB-008",
      "observation": [
        {
          "body": "success([pair(_A0_V0,_A0_V1)],false).\n",
          "http_status": 200
        }
      ],
      "status": "pass",
      "title": "Distinct template variables stay distinct"
    },
    {
      "duration_ms": 11,
      "id": "IB-009",
      "observation": [
        {
          "body": "{\"type\":\"success\",\"data\":[{\"X\":\"ok\"}],\"more\":false}\n",
          "http_status": 200
        }
      ],
      "status": "pass",
      "title": "JSON response exposes query bindings"
    },
    {
      "duration_ms": 21,
      "id": "IB-010",
      "observation": [
        {
          "body": "success([ok],false).\n",
          "http_status": 200
        },
        {
          "body": "{\"type\":\"error\",\"data\":\"error(permission_error(execute,isobase,/(baseline_private,0)),/(iso_execute,1))\"}\n",
          "http_status": 200
        }
      ],
      "status": "pass",
      "title": "Request source does not leak into the next request"
    }
  ],
  "schema_version": 2,
  "scope": "required",
  "started_at": "2026-10-21T10:06:01.450546+00:00",
  "suite": "isobase-http-0.1"
}
