{
  "advertised_profile": "actor",
  "baseline": "0.1",
  "candidate": "swi",
  "counts": {
    "diagnostic_error": 0,
    "fail": 0,
    "observed": 0,
    "pass": 6,
    "unsupported": 0
  },
  "duration_ms": 154,
  "endpoint": "ws://127.0.0.1:52141/ws",
  "peer": "http://127.0.0.1:52147",
  "results": [
    {
      "duration_ms": 24,
      "id": "CI-001",
      "observation": {
        "data": [
          {
            "BaselineResult": "passed",
            "Embedded": "4135472596@'http://127.0.0.1:52141'",
            "Me": "Me",
            "P": "4135472596@'http://127.0.0.1:52141'",
            "S": "8650466184@'http://127.0.0.1:52141'",
            "Self": "4135472596@'http://127.0.0.1:52141'"
          }
        ],
        "more": false,
        "pid": 8650466184,
        "type": "success"
      },
      "status": "pass",
      "title": "Spawn output pid is substituted inside the child goal"
    },
    {
      "duration_ms": 22,
      "id": "CI-002",
      "observation": {
        "data": [
          {
            "BaselineResult": "passed",
            "P": "4376625537@'http://127.0.0.1:52141'",
            "S": "1437458012@'http://127.0.0.1:52141'",
            "Value": "child",
            "X": "parent"
          }
        ],
        "more": false,
        "pid": 1437458012,
        "type": "success"
      },
      "status": "pass",
      "title": "Parent and child bindings remain independent"
    },
    {
      "duration_ms": 22,
      "id": "CI-003",
      "observation": {
        "data": [
          {
            "A": "A",
            "B": "B",
            "BaselineResult": "passed",
            "C": "C",
            "P": "4282920752@'http://127.0.0.1:52141'",
            "R1": "inside",
            "R2": "inside",
            "S": "9468322683@'http://127.0.0.1:52141'",
            "U": "parent_received",
            "V": "V"
          }
        ],
        "more": false,
        "pid": 9468322683,
        "type": "success"
      },
      "status": "pass",
      "title": "Goal and message copies preserve sharing without sharing variable identity"
    },
    {
      "duration_ms": 26,
      "id": "CI-004",
      "observation": {
        "data": [
          {
            "BaselineResult": "passed",
            "P": "1159644278@'http://127.0.0.1:52141'",
            "S": "5731837661@'http://127.0.0.1:52141'",
            "V": "V",
            "Values": "[alpha,beta]"
          }
        ],
        "more": false,
        "pid": 5731837661,
        "type": "success"
      },
      "status": "pass",
      "title": "Text source supplies child predicates in clause order"
    },
    {
      "duration_ms": 22,
      "id": "CI-005",
      "observation": {
        "data": [
          {
            "A": "A",
            "B": "A",
            "BaselineResult": "passed",
            "C": "C",
            "D": "D",
            "Data": "Data",
            "P": "5057665572@'http://127.0.0.1:52141'",
            "Rows": "[first-(A-A),second-pair(C,D)]",
            "S": "9520094330@'http://127.0.0.1:52141'",
            "Tag": "Tag",
            "X": "X",
            "Y": "Y",
            "Z": "Z"
          }
        ],
        "more": false,
        "pid": 9520094330,
        "type": "success"
      },
      "status": "pass",
      "title": "Clause-list source preserves order and within-clause variable sharing"
    },
    {
      "duration_ms": 37,
      "id": "CI-006",
      "observation": {
        "data": [
          {
            "After": "[parent]",
            "BaselineResult": "passed",
            "Before": "[parent]",
            "Changed": "[changed]",
            "Initial": "Initial",
            "P": "4411188179@'http://127.0.0.1:52141'",
            "Q": "6756418920@'http://127.0.0.1:52141'",
            "S": "2806655360@'http://127.0.0.1:52141'",
            "Sibling": "[right]",
            "V": "V",
            "Values": "Values"
          }
        ],
        "more": false,
        "pid": 2806655360,
        "type": "success"
      },
      "status": "pass",
      "title": "Sibling private databases and parent source remain isolated"
    }
  ],
  "schema_version": 2,
  "scope": "required",
  "started_at": "2026-10-25T11:14:41.031363+00:00",
  "suite": "copying-isolation-0.1"
}
