{
  "advertised_profile": "actor",
  "baseline": "0.1",
  "candidate": "swi",
  "counts": {
    "diagnostic_error": 0,
    "fail": 0,
    "observed": 0,
    "pass": 7,
    "unsupported": 0
  },
  "duration_ms": 182,
  "endpoint": "ws://127.0.0.1:61005/ws",
  "peer": null,
  "results": [
    {
      "duration_ms": 27,
      "id": "LC-001",
      "observation": {
        "data": [
          {
            "A": "7346020191",
            "Again": "3253470366@'http://127.0.0.1:61005'",
            "B": "6464922348",
            "BaselineResult": "passed",
            "Self": "3253470366@'http://127.0.0.1:61005'"
          }
        ],
        "more": false,
        "pid": 3253470366,
        "type": "success"
      },
      "status": "pass",
      "title": "Identity and references are opaque and stable"
    },
    {
      "duration_ms": 13,
      "id": "LC-002",
      "observation": {
        "data": [
          {
            "BaselineResult": "passed",
            "S": "4381383984@'http://127.0.0.1:61005'"
          }
        ],
        "more": false,
        "pid": 4381383984,
        "type": "success"
      },
      "status": "pass",
      "title": "Selective receive retains earlier unmatched data"
    },
    {
      "duration_ms": 14,
      "id": "LC-003",
      "observation": {
        "data": [
          {
            "BaselineResult": "passed",
            "S": "6174782740@'http://127.0.0.1:61005'",
            "X": "X",
            "Y": "1"
          }
        ],
        "more": false,
        "pid": 6174782740,
        "type": "success"
      },
      "status": "pass",
      "title": "Failed guards preserve messages"
    },
    {
      "duration_ms": 42,
      "id": "LC-004",
      "observation": {
        "data": [
          {
            "BaselineResult": "passed",
            "E": "baseline_error",
            "X": "one",
            "Y": "two"
          }
        ],
        "more": false,
        "pid": 3715884695,
        "type": "success"
      },
      "status": "pass",
      "title": "Parallel bindings failure and exception"
    },
    {
      "duration_ms": 37,
      "id": "LC-005",
      "observation": {
        "data": [
          {
            "BaselineResult": "passed",
            "X": "ok",
            "Y": "ready"
          }
        ],
        "more": false,
        "pid": 1118639840,
        "type": "success"
      },
      "status": "pass",
      "title": "First solution returns one winner and applies continue policy"
    },
    {
      "duration_ms": 28,
      "id": "LC-006",
      "observation": {
        "data": [
          {
            "A": "success(6450402880@'http://127.0.0.1:61005',[a,b],true)",
            "B": "success(6450402880@'http://127.0.0.1:61005',[c],false)",
            "BaselineResult": "passed",
            "P": "6450402880@'http://127.0.0.1:61005'",
            "X": "X"
          }
        ],
        "more": false,
        "pid": 3461374318,
        "type": "success"
      },
      "status": "pass",
      "title": "Synchronous toplevel paging returns answer terms"
    },
    {
      "duration_ms": 22,
      "id": "LC-007",
      "observation": {
        "data": [
          {
            "A": "failure(2617506072@'http://127.0.0.1:61005')",
            "B": "error(2617506072@'http://127.0.0.1:61005',baseline_error)",
            "BaselineResult": "passed",
            "P": "2617506072@'http://127.0.0.1:61005'"
          }
        ],
        "more": false,
        "pid": 9796466466,
        "type": "success"
      },
      "status": "pass",
      "title": "Synchronous failure and exception remain answer terms"
    }
  ],
  "schema_version": 2,
  "scope": "required",
  "started_at": "2026-10-21T10:43:01.969198+00:00",
  "suite": "language-actor-0.1"
}
