{
  "advertised_profile": "actor",
  "baseline": "0.1",
  "candidate": "swi",
  "counts": {
    "diagnostic_error": 2,
    "fail": 0,
    "observed": 0,
    "pass": 0,
    "unsupported": 0
  },
  "duration_ms": 42,
  "endpoint": "ws://127.0.0.1:52156/ws",
  "peer": null,
  "results": [
    {
      "detail": "ConformanceFailure: expected success, got {'data': 'Arguments are not sufficiently instantiated', 'details': 'error(instantiation_error,_)', 'type': 'error'}; preceding events were []",
      "duration_ms": 30,
      "id": "SVD-001",
      "status": "diagnostic_error",
      "title": "Dynamic validation with stage-specific wait diagnostics"
    },
    {
      "detail": "ConformanceFailure: expected success, got {'data': 'Arguments are not sufficiently instantiated', 'details': 'error(instantiation_error,_)', 'type': 'error'}; preceding events were []",
      "duration_ms": 12,
      "id": "SVD-002",
      "status": "diagnostic_error",
      "title": "Runtime-bound child validation with entry output marker"
    }
  ],
  "schema_version": 2,
  "scope": "diagnostic",
  "started_at": "2026-10-24T17:51:08.232878+00:00",
  "suite": "child-spec-diagnostics-0.1"
}
