{
  "advertised_profile": "isobase",
  "baseline": "0.1",
  "candidate": "gnu",
  "counts": {
    "diagnostic_error": 0,
    "fail": 0,
    "observed": 6,
    "pass": 0,
    "unsupported": 0
  },
  "duration_ms": 69,
  "endpoint": "http://127.0.0.1:57367",
  "peer": null,
  "results": [
    {
      "duration_ms": 17,
      "id": "IBD-001",
      "issue": "GNU ISOBASE D01/K01; no zero-limit decision is made by this baseline",
      "observation": [
        {
          "body": "failure.\n",
          "http_status": 200
        }
      ],
      "status": "observed",
      "title": "Zero limit remains a recorded GNU/shared-contract difference"
    },
    {
      "duration_ms": 10,
      "id": "IBD-002",
      "issue": "GNU ISOBASE contract 0.2.0 B01: normative in that draft, not waived by this scoped baseline",
      "observation": [
        {
          "body": "success([ok],false).\n",
          "http_status": 200
        }
      ],
      "status": "observed",
      "title": "ISO power result type vs SWI arithmetic extension"
    },
    {
      "duration_ms": 11,
      "id": "IBD-003",
      "issue": "Portable Text 0.1 remains experimental",
      "observation": [
        {
          "body": "failure.\n",
          "http_status": 200
        }
      ],
      "status": "observed",
      "title": "Double-quoted character-list experiment"
    },
    {
      "duration_ms": 10,
      "id": "IBD-004",
      "issue": "Record response/status without freezing a new HTTP status rule",
      "observation": [
        {
          "body": "error(error(syntax_error('constant term stream:1 (char:16) expression expected'),/(read_term_from_atom,3))).\n",
          "http_status": 200
        }
      ],
      "status": "observed",
      "title": "Malformed goal error and HTTP status"
    },
    {
      "duration_ms": 10,
      "id": "IBD-005",
      "issue": "GNU ISOBASE numeric/text reconciliation retains authority for its requirements",
      "observation": [
        {
          "body": "success([accepted(2)],false).\n",
          "http_status": 200
        }
      ],
      "status": "observed",
      "title": "Numeric conversion type/error boundary"
    },
    {
      "duration_ms": 10,
      "id": "IBD-006",
      "issue": "Record operator-framing differences; baseline requests frame goal and template in parentheses on every candidate",
      "observation": [
        {
          "body": "{\"type\":\"success\",\"data\":[{\"X\":\"ok\"}],\"more\":false}\n",
          "http_status": 200
        }
      ],
      "status": "observed",
      "title": "Unparenthesized operator goal in flat HTTP parameters"
    }
  ],
  "schema_version": 2,
  "scope": "diagnostic",
  "started_at": "2026-10-21T10:06:01.671423+00:00",
  "suite": "isobase-diagnostics-0.1"
}
