{
  "advertised_profile": "actor",
  "baseline": "0.1",
  "candidate": "trealla",
  "counts": {
    "diagnostic_error": 0,
    "fail": 0,
    "observed": 0,
    "pass": 6,
    "unsupported": 0
  },
  "duration_ms": 1347,
  "endpoint": "ws://127.0.0.1:52395/ws",
  "peer": "http://127.0.0.1:52389",
  "results": [
    {
      "duration_ms": 241,
      "id": "TW-001",
      "observation": {
        "data": [
          {
            "A": "success(1615149211,[ok],false)",
            "BaselineResult": "passed",
            "E": "error(domain_error(synchronous_toplevel_target,other),context(toplevel_actors:toplevel_call_synch/4,'invalid synchronous toplevel option'))",
            "P": "1615149211",
            "S": "1889289318@'http://127.0.0.1:52395'",
            "X": "X"
          }
        ],
        "more": false,
        "pid": 1889289318,
        "type": "success"
      },
      "status": "pass",
      "title": "Caller targeting and independent query variables"
    },
    {
      "duration_ms": 256,
      "id": "TW-002",
      "observation": {
        "data": [
          {
            "A": "A",
            "B": "success(1736921271,[true],false)",
            "Barrier": "success(1736921271,[true],false)",
            "BaselineResult": "passed",
            "C": "success(1736921271,[true],false)",
            "D": "success(1736921271,[true],false)",
            "E": "tw_callback",
            "Me": "Me",
            "P": "1736921271",
            "S": "3089496452@'http://127.0.0.1:52395'",
            "V": "V",
            "Vs": "[first]"
          }
        ],
        "more": false,
        "pid": 3089496452,
        "type": "success"
      },
      "status": "pass",
      "title": "Timeout outcome and callback bindings failure exceptions and commitment"
    },
    {
      "duration_ms": 234,
      "id": "TW-003",
      "observation": {
        "data": [
          {
            "A": "success(1765818810,[fresh],false)",
            "BaselineResult": "passed",
            "Early": "Early",
            "First": "success(1765818810,[a],true)",
            "Last": "success(1765818810,[c],false)",
            "Late": "Late",
            "Me": "Me",
            "Me2": "Me2",
            "P": "1765818810",
            "S": "3026018584@'http://127.0.0.1:52395'",
            "X": "X"
          }
        ],
        "more": false,
        "pid": 3026018584,
        "type": "success"
      },
      "status": "pass",
      "title": "Late timed-out answer cannot satisfy the next synchronous wait"
    },
    {
      "duration_ms": 231,
      "id": "TW-004",
      "observation": {
        "data": [
          {
            "A": "success(2617249839,[c,d],false)",
            "BaselineResult": "passed",
            "P": "2617249839",
            "X": "X"
          }
        ],
        "more": false,
        "pid": 3049147933,
        "type": "success"
      },
      "status": "pass",
      "title": "Output mismatch consumes selected slice and continuation advances"
    },
    {
      "duration_ms": 136,
      "id": "TW-005",
      "observation": {
        "data": [
          {
            "BaselineResult": "passed",
            "E": "toplevel_down(tw_death)",
            "P": "1496980934",
            "R": "1000001115"
          }
        ],
        "more": false,
        "pid": 1866351284,
        "type": "success"
      },
      "status": "pass",
      "title": "Termination during wait preserves independent and spawn monitors"
    },
    {
      "duration_ms": 249,
      "id": "TW-006",
      "observation": {
        "data": [
          {
            "A": "success(2000094243,[sync],false)",
            "BaselineResult": "passed",
            "P": "2000094243",
            "R": "1000001128",
            "S": "1950105536@'http://127.0.0.1:52395'"
          }
        ],
        "more": false,
        "pid": 1950105536,
        "type": "success"
      },
      "status": "pass",
      "title": "Synchronous wait preserves asynchronous answers and unrelated messages"
    }
  ],
  "schema_version": 2,
  "scope": "required",
  "started_at": "2026-10-25T11:16:43.186319+00:00",
  "suite": "toplevel-waits-0.1"
}
