{
  "advertised_profile": "actor",
  "baseline": "0.1",
  "candidate": "trealla",
  "counts": {
    "diagnostic_error": 0,
    "fail": 2,
    "observed": 0,
    "pass": 0,
    "unsupported": 0
  },
  "duration_ms": 14,
  "endpoint": "http://127.0.0.1:57360",
  "peer": "http://127.0.0.1:57360",
  "results": [
    {
      "detail": "ConformanceFailure: expected 'success([[a,b,c]],false).', got 'error(error(existence_error(procedure,rpc/3),rpc/3)).\\n'",
      "duration_ms": 11,
      "id": "HC-001",
      "status": "fail",
      "title": "RPC preserves all pages"
    },
    {
      "detail": "ConformanceFailure: expected 'success([ok],false).', got 'error(error(existence_error(procedure,promise/4),promise/4)).\\n'",
      "duration_ms": 4,
      "id": "HC-002",
      "status": "fail",
      "title": "Promise preserves template sharing and caller independence"
    }
  ],
  "schema_version": 2,
  "scope": "required",
  "started_at": "2026-10-21T10:06:13.797592+00:00",
  "suite": "interop-http-0.1"
}
