{
  "schema_version": 2,
  "baseline": "0.1",
  "suite": "language-actor-0.1",
  "scope": "required",
  "candidate": "swi-wasm-main",
  "advertised_profile": "actor",
  "endpoint": "embedded-main",
  "peer": null,
  "started_at": "2026-10-21T10:24:48.854Z",
  "duration_ms": 1297,
  "counts": {
    "pass": 7,
    "fail": 0,
    "unsupported": 0,
    "observed": 0,
    "diagnostic_error": 0
  },
  "results": [
    {
      "id": "LC-001",
      "title": "Identity and references are opaque and stable",
      "observation": {
        "solutions": 1
      },
      "status": "pass",
      "duration_ms": 1
    },
    {
      "id": "LC-002",
      "title": "Selective receive retains earlier unmatched data",
      "observation": {
        "solutions": 1
      },
      "status": "pass",
      "duration_ms": 1
    },
    {
      "id": "LC-003",
      "title": "Failed guards preserve messages",
      "observation": {
        "solutions": 1
      },
      "status": "pass",
      "duration_ms": 1
    },
    {
      "id": "LC-004",
      "title": "Parallel bindings failure and exception",
      "observation": {
        "solutions": 1
      },
      "status": "pass",
      "duration_ms": 510
    },
    {
      "id": "LC-005",
      "title": "First solution returns one winner and applies continue policy",
      "observation": {
        "solutions": 1
      },
      "status": "pass",
      "duration_ms": 377
    },
    {
      "id": "LC-006",
      "title": "Synchronous toplevel paging returns answer terms",
      "observation": {
        "solutions": 1
      },
      "status": "pass",
      "duration_ms": 119
    },
    {
      "id": "LC-007",
      "title": "Synchronous failure and exception remain answer terms",
      "observation": {
        "solutions": 1
      },
      "status": "pass",
      "duration_ms": 123
    }
  ]
}
