{
  "advertised_profile": "actor",
  "baseline": "0.1",
  "candidate": "swi",
  "counts": {
    "diagnostic_error": 0,
    "fail": 0,
    "observed": 0,
    "pass": 10,
    "unsupported": 0
  },
  "duration_ms": 147,
  "endpoint": "http://127.0.0.1:55146",
  "peer": null,
  "results": [
    {
      "duration_ms": 36,
      "id": "IB-001",
      "observation": [
        {
          "body": "success([ok],false).\n",
          "http_status": 200
        }
      ],
      "status": "pass",
      "title": "Deterministic success"
    },
    {
      "duration_ms": 11,
      "id": "IB-002",
      "observation": [
        {
          "body": "failure.\n",
          "http_status": 200
        }
      ],
      "status": "pass",
      "title": "Logical failure"
    },
    {
      "duration_ms": 15,
      "id": "IB-003",
      "observation": [
        {
          "body": "success([a,b],true).\n",
          "http_status": 200
        },
        {
          "body": "success([c],false).\n",
          "http_status": 200
        }
      ],
      "status": "pass",
      "title": "Paged enumeration and final-page state"
    },
    {
      "duration_ms": 11,
      "id": "IB-004",
      "observation": [
        {
          "body": "success([b],false).\n",
          "http_status": 200
        }
      ],
      "status": "pass",
      "title": "Offset and once stop at the requested slice"
    },
    {
      "duration_ms": 10,
      "id": "IB-005",
      "observation": [
        {
          "body": "error(baseline_probe).\n",
          "http_status": 200
        }
      ],
      "status": "pass",
      "title": "Uncaught exception is an error answer"
    },
    {
      "duration_ms": 10,
      "id": "IB-006",
      "observation": [
        {
          "body": "success([a,b],false).\n",
          "http_status": 200
        }
      ],
      "status": "pass",
      "title": "Supplied source executes in the request"
    },
    {
      "duration_ms": 10,
      "id": "IB-007",
      "observation": [
        {
          "body": "success([pair(_22722,_22722)],false).\n",
          "http_status": 200
        }
      ],
      "status": "pass",
      "title": "Prolog template preserves variable sharing"
    },
    {
      "duration_ms": 10,
      "id": "IB-008",
      "observation": [
        {
          "body": "success([pair(_11194,_11196)],false).\n",
          "http_status": 200
        }
      ],
      "status": "pass",
      "title": "Distinct template variables stay distinct"
    },
    {
      "duration_ms": 11,
      "id": "IB-009",
      "observation": [
        {
          "body": "{\"data\": [ {\"X\":\"ok\"} ],\"more\":false,\"type\":\"success\"}",
          "http_status": 200
        }
      ],
      "status": "pass",
      "title": "JSON response exposes query bindings"
    },
    {
      "duration_ms": 21,
      "id": "IB-010",
      "observation": [
        {
          "body": "success([ok],false).\n",
          "http_status": 200
        },
        {
          "body": "{\n  \"data\":\"Unknown procedure: baseline_private/0\",\n  \"details\":\"error(existence_error(procedure,baseline_private/0),_)\",\n  \"type\":\"error\"\n}",
          "http_status": 200
        }
      ],
      "status": "pass",
      "title": "Request source does not leak into the next request"
    }
  ],
  "schema_version": 2,
  "scope": "required",
  "started_at": "2026-10-21T19:37:11.192584+00:00",
  "suite": "isobase-http-0.1"
}
