{
  "advertised_profile": "actor",
  "baseline": "0.1",
  "candidate": "swi",
  "counts": {
    "diagnostic_error": 0,
    "fail": 0,
    "observed": 3,
    "pass": 0,
    "unsupported": 0
  },
  "duration_ms": 1283,
  "endpoint": "ws://127.0.0.1:50184/ws",
  "peer": "http://127.0.0.1:50190",
  "results": [
    {
      "duration_ms": 15,
      "id": "PYD-001",
      "observation": {
        "data": [
          {
            "BaselineResult": "passed",
            "S": "7472000226@'http://127.0.0.1:50184'"
          }
        ],
        "more": false,
        "pid": 7472000226,
        "type": "success"
      },
      "status": "observed",
      "title": "Actor message sending outside a callback"
    },
    {
      "duration_ms": 625,
      "id": "PYD-002",
      "observation": {
        "data": [
          {
            "A": "success([ok],false)",
            "BaselineResult": "passed",
            "Early": "waiting",
            "R": "1837416474",
            "X": "X"
          }
        ],
        "more": false,
        "pid": 3132381054,
        "type": "success"
      },
      "status": "observed",
      "title": "Timeout callback using only unification"
    },
    {
      "duration_ms": 643,
      "id": "PYD-003",
      "observation": {
        "data": [
          {
            "A": "success([ok],false)",
            "BaselineResult": "passed",
            "E": "callback_probe",
            "R": "6292887494",
            "X": "X"
          }
        ],
        "more": false,
        "pid": 3675970395,
        "type": "success"
      },
      "status": "observed",
      "title": "Timeout callback invokes ordinary unification and exception control"
    }
  ],
  "schema_version": 2,
  "scope": "diagnostic",
  "started_at": "2026-10-24T15:41:13.230385+00:00",
  "suite": "promise-diagnostics-0.1"
}
