{
  "advertised_profile": "actor",
  "baseline": "0.1",
  "candidate": "trealla",
  "counts": {
    "diagnostic_error": 0,
    "fail": 0,
    "observed": 0,
    "pass": 3,
    "unsupported": 0
  },
  "duration_ms": 39,
  "endpoint": "ws://127.0.0.1:55152/ws",
  "peer": null,
  "results": [
    {
      "duration_ms": 14,
      "id": "WP-001",
      "observation": {
        "negotiated_subprotocol": "web-prolog-sync-spawn-v1",
        "replies": [
          {
            "data": "error(permission_error(access,web_prolog_actor,99999999999),web_prolog_handler/2)",
            "type": "error"
          },
          {
            "pid": 1443082941,
            "request_id": "baseline-good",
            "type": "spawned"
          },
          {
            "data": "error(permission_error(access,web_prolog_actor,99999999999),web_prolog_handler/2)",
            "type": "error"
          },
          {
            "data": "error(syntax_error(read_term),read_term/3)",
            "request_id": "baseline-bad",
            "type": "error"
          }
        ]
      },
      "status": "pass",
      "title": "Combined spawn/query correlation negotiation and per-command reply IDs"
    },
    {
      "duration_ms": 12,
      "id": "WP-002",
      "observation": {
        "negotiated_subprotocol": "web-prolog-sync-v1",
        "replies": [
          {
            "data": "error(permission_error(access,web_prolog_actor,99999999999),web_prolog_handler/2)",
            "type": "error"
          },
          {
            "pid": 1443267818,
            "type": "spawned"
          },
          {
            "data": "error(permission_error(access,web_prolog_actor,99999999999),web_prolog_handler/2)",
            "type": "error"
          },
          {
            "data": "error(syntax_error(read_term),read_term/3)",
            "type": "error"
          }
        ]
      },
      "status": "pass",
      "title": "Legacy toplevel-correlation offer remains accepted"
    },
    {
      "duration_ms": 12,
      "id": "WP-003",
      "observation": {
        "negotiated_subprotocol": null,
        "replies": [
          {
            "data": "error(permission_error(access,web_prolog_actor,99999999999),web_prolog_handler/2)",
            "type": "error"
          },
          {
            "pid": 1443452695,
            "type": "spawned"
          },
          {
            "data": "error(permission_error(access,web_prolog_actor,99999999999),web_prolog_handler/2)",
            "type": "error"
          },
          {
            "data": "error(syntax_error(read_term),read_term/3)",
            "type": "error"
          }
        ]
      },
      "status": "pass",
      "title": "Unnegotiated actor transport remains accepted"
    }
  ],
  "schema_version": 2,
  "scope": "required",
  "started_at": "2026-10-21T19:37:27.023406+00:00",
  "suite": "wire-capabilities-0.1"
}
