{
  "advertised_profile": "actor",
  "baseline": "0.1",
  "candidate": "swi",
  "counts": {
    "diagnostic_error": 0,
    "fail": 0,
    "observed": 2,
    "pass": 0,
    "unsupported": 0
  },
  "duration_ms": 48,
  "endpoint": "ws://127.0.0.1:52349/ws",
  "peer": null,
  "results": [
    {
      "duration_ms": 34,
      "id": "AMC-001",
      "observation": {
        "complete": true,
        "entry_response": {
          "data": [
            {
              "ProbeEntry": "yes"
            }
          ],
          "more": false,
          "pid": 5489774471,
          "type": "success"
        },
        "execution_entered": true,
        "terminal": {
          "data": "Unknown message: admission_runtime_error",
          "details": "admission_runtime_error",
          "pid": 5489774471,
          "type": "error"
        },
        "transcript": [
          {
            "direction": "send",
            "message": {
              "browser_pids": true,
              "command": "transport_hello",
              "io_ack": true,
              "version": 1
            }
          },
          {
            "direction": "receive",
            "message": {
              "answer_terms": false,
              "browser_pids": true,
              "io_ack": true,
              "protocol": "web_prolog_browser_actor",
              "type": "transport_welcome",
              "version": 1
            }
          },
          {
            "direction": "send",
            "message": {
              "command": "toplevel_spawn",
              "options": "[session(true)]"
            }
          },
          {
            "direction": "receive",
            "message": {
              "pid": 5489774471,
              "type": "spawned"
            }
          },
          {
            "direction": "send",
            "message": {
              "command": "toplevel_call",
              "goal": "(self(ProbeSelf),ProbeSelf!admission_probe_entered,(throw(admission_runtime_error))),ProbeComplete=completed",
              "options": "[limit(1)]",
              "pid": 5489774471
            }
          },
          {
            "direction": "receive",
            "message": {
              "data": "Unknown message: admission_runtime_error",
              "details": "admission_runtime_error",
              "pid": 5489774471,
              "type": "error"
            }
          },
          {
            "direction": "send",
            "message": {
              "command": "toplevel_call",
              "goal": "receive({admission_probe_entered->ProbeEntry=yes},[timeout(0),on_timeout(ProbeEntry=no)])",
              "options": "[limit(1)]",
              "pid": 5489774471
            }
          },
          {
            "direction": "receive",
            "message": {
              "data": [
                {
                  "ProbeEntry": "yes"
                }
              ],
              "more": false,
              "pid": 5489774471,
              "type": "success"
            }
          },
          {
            "direction": "send",
            "message": {
              "command": "toplevel_halt",
              "pid": 5489774471
            }
          },
          {
            "direction": "receive",
            "message": {
              "pid": 5489774471,
              "reason": "true",
              "ref": "5489774471@'http://127.0.0.1:52349'",
              "type": "down"
            }
          },
          {
            "direction": "receive",
            "message": {
              "pid": 5489774471,
              "reply": "true",
              "type": "halted"
            }
          }
        ]
      },
      "status": "observed",
      "title": "Ordinary query exception retains the entry marker"
    },
    {
      "duration_ms": 14,
      "id": "AMC-002",
      "observation": {
        "complete": true,
        "entry_response": {
          "data": [
            {
              "ProbeEntry": "yes"
            }
          ],
          "more": false,
          "pid": 2661556242,
          "type": "success"
        },
        "execution_entered": true,
        "terminal": {
          "pid": 2661556242,
          "type": "failure"
        },
        "transcript": [
          {
            "direction": "send",
            "message": {
              "browser_pids": true,
              "command": "transport_hello",
              "io_ack": true,
              "version": 1
            }
          },
          {
            "direction": "receive",
            "message": {
              "answer_terms": false,
              "browser_pids": true,
              "io_ack": true,
              "protocol": "web_prolog_browser_actor",
              "type": "transport_welcome",
              "version": 1
            }
          },
          {
            "direction": "send",
            "message": {
              "command": "toplevel_spawn",
              "options": "[session(true)]"
            }
          },
          {
            "direction": "receive",
            "message": {
              "pid": 2661556242,
              "type": "spawned"
            }
          },
          {
            "direction": "send",
            "message": {
              "command": "toplevel_call",
              "goal": "(self(ProbeSelf),ProbeSelf!admission_probe_entered,(fail)),ProbeComplete=completed",
              "options": "[limit(1)]",
              "pid": 2661556242
            }
          },
          {
            "direction": "receive",
            "message": {
              "pid": 2661556242,
              "type": "failure"
            }
          },
          {
            "direction": "send",
            "message": {
              "command": "toplevel_call",
              "goal": "receive({admission_probe_entered->ProbeEntry=yes},[timeout(0),on_timeout(ProbeEntry=no)])",
              "options": "[limit(1)]",
              "pid": 2661556242
            }
          },
          {
            "direction": "receive",
            "message": {
              "data": [
                {
                  "ProbeEntry": "yes"
                }
              ],
              "more": false,
              "pid": 2661556242,
              "type": "success"
            }
          },
          {
            "direction": "send",
            "message": {
              "command": "toplevel_halt",
              "pid": 2661556242
            }
          },
          {
            "direction": "receive",
            "message": {
              "pid": 2661556242,
              "reason": "true",
              "ref": "2661556242@'http://127.0.0.1:52349'",
              "type": "down"
            }
          },
          {
            "direction": "receive",
            "message": {
              "pid": 2661556242,
              "reply": "true",
              "type": "halted"
            }
          }
        ]
      },
      "status": "observed",
      "title": "Ordinary logical failure retains the entry marker"
    }
  ],
  "schema_version": 2,
  "scope": "diagnostic",
  "started_at": "2026-10-24T18:00:53.695238+00:00",
  "suite": "admission-marker-controls-0.1"
}
