{
  "advertised_profile": "actor",
  "baseline": "0.1",
  "candidate": "trealla",
  "counts": {
    "diagnostic_error": 0,
    "fail": 1,
    "observed": 0,
    "pass": 5,
    "unsupported": 0
  },
  "duration_ms": 2662,
  "endpoint": "ws://127.0.0.1:52184/ws",
  "peer": null,
  "results": [
    {
      "duration_ms": 132,
      "id": "SV-001",
      "observation": {
        "data": [
          {
            "BaselineResult": "passed",
            "E": "error(missing_start_option(a),context(supervisor_actor:supervisor_spawn/3,'invalid child specification'))",
            "S": "1713801970@'http://127.0.0.1:52184'",
            "Specs": "[child(a,[])]",
            "Sup": "Sup"
          }
        ],
        "more": false,
        "pid": 1713801970,
        "type": "success"
      },
      "status": "pass",
      "title": "Required start is rejected without creating a supervisor"
    },
    {
      "duration_ms": 124,
      "id": "SV-002",
      "observation": {
        "data": [
          {
            "BaselineResult": "passed",
            "E": "error(permission_error(duplicate,supervisor_child_id,a),context(supervisor_actor:supervisor_spawn/3,'invalid child specification'))",
            "S": "1062363281@'http://127.0.0.1:52184'",
            "Specs": "[child(a,[start(true)]),child(a,[start(true)])]",
            "Sup": "Sup"
          }
        ],
        "more": false,
        "pid": 1062363281,
        "type": "success"
      },
      "status": "pass",
      "title": "Initial child identifiers must be unique"
    },
    {
      "duration_ms": 122,
      "id": "SV-003",
      "observation": {
        "data": [
          {
            "BaselineResult": "passed",
            "E1": "error(type_error(list,[child(a,[start(true)])|bad]),context(supervisor_actor:supervisor_spawn/3,'invalid child specification'))",
            "E2": "error(type_error(list,[start(true)|bad]),context(supervisor_actor:supervisor_spawn/3,'invalid child specification'))",
            "Inner": "[child(a,[start(true)|bad])]",
            "Outer": "[child(a,[start(true)])|bad]",
            "P": "P",
            "Q": "Q",
            "S": "1534316555@'http://127.0.0.1:52184'"
          }
        ],
        "more": false,
        "pid": 1534316555,
        "type": "success"
      },
      "status": "pass",
      "title": "Malformed initial child and child-option lists are rejected"
    },
    {
      "duration_ms": 123,
      "id": "SV-004",
      "observation": {
        "data": [
          {
            "BaselineResult": "passed",
            "E1": "error(domain_error(supervisor_child_restart,bad),context(supervisor_actor:supervisor_spawn/3,'invalid child specification'))",
            "E2": "error(domain_error(supervisor_child_shutdown,-1),context(supervisor_actor:supervisor_spawn/3,'invalid child specification'))",
            "Formal": "domain_error(supervisor_child_restart,bad)",
            "P": "P",
            "Q": "Q",
            "Restart": "[child(a,[start(true),restart(temporary),restart(bad)])]",
            "S": "2293144661@'http://127.0.0.1:52184'",
            "Shutdown": "[child(a,[start(true),shutdown(0),shutdown(-1)])]"
          }
        ],
        "more": false,
        "pid": 2293144661,
        "type": "success"
      },
      "status": "pass",
      "title": "Later restart and shutdown occurrences are validated"
    },
    {
      "duration_ms": 127,
      "id": "SV-005",
      "observation": {
        "data": [
          {
            "After": "[1480258155@'http://127.0.0.1:52184']",
            "BaselineResult": "passed",
            "Before": "[1480258155@'http://127.0.0.1:52184']",
            "E": "error(missing_start_option(inner),context(supervisor_actor:supervisor_spawn/3,'invalid child specification'))",
            "S": "1480258155@'http://127.0.0.1:52184'",
            "Sorted": "[1480258155@'http://127.0.0.1:52184']",
            "Specs": "[child(probe,[start((1480258155@'http://127.0.0.1:52184'!unexpected_nested_start,receive({never->true})))]),child(outer,[start(start_sub_supervisor([child(inner,[])],[]))])]",
            "Sup": "Sup"
          }
        ],
        "more": false,
        "pid": 1480258155,
        "type": "success"
      },
      "status": "pass",
      "title": "Nested invalid specification is rejected before any initial startup"
    },
    {
      "detail": "ConformanceFailure: expected success, got {'type': 'error', 'pid': 1573163957, 'data': 'missing_invalid_spec_data'}; preceding events were []",
      "duration_ms": 2033,
      "id": "SV-006",
      "status": "fail",
      "title": "Dynamic rejection preserves siblings and allows valid retry"
    }
  ],
  "schema_version": 2,
  "scope": "required",
  "started_at": "2026-10-24T17:52:07.499944+00:00",
  "suite": "child-specs-0.1"
}
