{
  "advertised_profile": "actor",
  "baseline": "0.1",
  "candidate": "swi",
  "counts": {
    "diagnostic_error": 0,
    "fail": 3,
    "observed": 0,
    "pass": 0,
    "unsupported": 0
  },
  "duration_ms": 69,
  "endpoint": "ws://127.0.0.1:52141/ws",
  "peer": "http://127.0.0.1:52147",
  "results": [
    {
      "detail": "ConformanceFailure: expected success, got {'data': 'actor:remote_request_spawn/3: Unknown error term: remote_spawn_failed(\"error(permission_error(use,transport_lineage,string([e,\\'7\\',\\'5\\',f,e,\\'0\\',a,\\'1\\',\\'0\\',\\'3\\',c,\\'2\\',\\'6\\',\\'0\\',f,\\'9\\',d,a,\\'1\\',c,\\'4\\',f,\\'4\\',\\'8\\',\\'0\\',f,e,\\'2\\',\\'2\\',\\'1\\',\\'0\\',c])),receiver_lineage)\") (remote node reported spawn failure)', 'details': 'error(remote_spawn_failed(\"error(permission_error(use,transport_lineage,string([e,\\'7\\',\\'5\\',f,e,\\'0\\',a,\\'1\\',\\'0\\',\\'3\\',c,\\'2\\',\\'6\\',\\'0\\',f,\\'9\\',d,a,\\'1\\',c,\\'4\\',f,\\'4\\',\\'8\\',\\'0\\',f,e,\\'2\\',\\'2\\',\\'1\\',\\'0\\',c])),receiver_lineage)\"),_)', 'pid': 4762845832, 'type': 'error'}; preceding events were []",
      "duration_ms": 27,
      "id": "IX-001",
      "status": "fail",
      "title": "Remote source, synchronous paging and spawn monitor"
    },
    {
      "detail": "ConformanceFailure: expected success, got {'data': 'actor:remote_request_spawn/3: Unknown error term: remote_spawn_failed(\"error(permission_error(use,transport_lineage,string([\\'5\\',b,\\'2\\',a,\\'6\\',f,\\'1\\',\\'0\\',\\'7\\',\\'6\\',d,\\'1\\',\\'4\\',\\'7\\',\\'0\\',f,a,\\'2\\',\\'3\\',a,e,a,\\'2\\',f,a,\\'9\\',\\'7\\',\\'1\\',f,\\'3\\',\\'3\\',\\'0\\'])),receiver_lineage)\") (remote node reported spawn failure)', 'details': 'error(remote_spawn_failed(\"error(permission_error(use,transport_lineage,string([\\'5\\',b,\\'2\\',a,\\'6\\',f,\\'1\\',\\'0\\',\\'7\\',\\'6\\',d,\\'1\\',\\'4\\',\\'7\\',\\'0\\',f,a,\\'2\\',\\'3\\',a,e,a,\\'2\\',f,a,\\'9\\',\\'7\\',\\'1\\',f,\\'3\\',\\'3\\',\\'0\\'])),receiver_lineage)\"),_)', 'pid': 6437309269, 'type': 'error'}; preceding events were []",
      "duration_ms": 17,
      "id": "IX-002",
      "status": "fail",
      "title": "Canonical asynchronous answers preserve shared variables and quoted atoms"
    },
    {
      "detail": "ConformanceFailure: expected success, got {'data': 'actor:remote_request_spawn/3: Unknown error term: remote_spawn_failed(\"error(permission_error(use,transport_lineage,string([\\'4\\',\\'0\\',\\'1\\',\\'4\\',\\'1\\',c,\\'3\\',\\'0\\',\\'7\\',\\'3\\',\\'7\\',\\'0\\',\\'2\\',d,\\'9\\',\\'2\\',d,\\'0\\',d,\\'2\\',\\'1\\',\\'7\\',\\'4\\',e,a,\\'7\\',\\'3\\',a,c,\\'9\\',\\'7\\',f])),receiver_lineage)\") (remote node reported spawn failure)', 'details': 'error(remote_spawn_failed(\"error(permission_error(use,transport_lineage,string([\\'4\\',\\'0\\',\\'1\\',\\'4\\',\\'1\\',c,\\'3\\',\\'0\\',\\'7\\',\\'3\\',\\'7\\',\\'0\\',\\'2\\',d,\\'9\\',\\'2\\',d,\\'0\\',d,\\'2\\',\\'1\\',\\'7\\',\\'4\\',e,a,\\'7\\',\\'3\\',a,c,\\'9\\',\\'7\\',f])),receiver_lineage)\"),_)', 'pid': 2687712342, 'type': 'error'}; preceding events were []",
      "duration_ms": 25,
      "id": "IX-003",
      "status": "fail",
      "title": "Remote calls preserve an unrelated local monitor and message"
    }
  ],
  "schema_version": 2,
  "scope": "required",
  "started_at": "2026-10-25T11:14:45.460404+00:00",
  "suite": "interop-actor-0.1"
}
