{
  "advertised_profile": "actor",
  "baseline": "0.1",
  "candidate": "swi",
  "counts": {
    "diagnostic_error": 0,
    "fail": 0,
    "observed": 0,
    "pass": 6,
    "unsupported": 0
  },
  "duration_ms": 323,
  "endpoint": "ws://127.0.0.1:51185/ws",
  "peer": null,
  "results": [
    {
      "duration_ms": 67,
      "id": "LM-001",
      "observation": {
        "data": [
          {
            "BaselineResult": "passed",
            "E": "2138896261@'http://127.0.0.1:51185'",
            "F": "6450367080@'http://127.0.0.1:51185'",
            "K": "6409614032@'http://127.0.0.1:51185'",
            "P": "3567645983@'http://127.0.0.1:51185'"
          }
        ],
        "more": false,
        "pid": 8480190235,
        "type": "success"
      },
      "status": "pass",
      "title": "Spawn monitoring preserves immediate success failure exception and explicit exit"
    },
    {
      "duration_ms": 20,
      "id": "LM-002",
      "observation": {
        "data": [
          {
            "BaselineResult": "passed",
            "P": "5302384919@'http://127.0.0.1:51185'",
            "R": "8283618073",
            "S": "2528823285@'http://127.0.0.1:51185'"
          }
        ],
        "more": false,
        "pid": 2528823285,
        "type": "success"
      },
      "status": "pass",
      "title": "Explicit and spawn-time monitors are independent and preserve unrelated data"
    },
    {
      "duration_ms": 20,
      "id": "LM-003",
      "observation": {
        "data": [
          {
            "BaselineResult": "passed",
            "P": "2244120970@'http://127.0.0.1:51185'",
            "R": "6470992723"
          }
        ],
        "more": false,
        "pid": 4143960104,
        "type": "success"
      },
      "status": "pass",
      "title": "Monitoring a terminated actor yields no_process with the returned reference"
    },
    {
      "duration_ms": 32,
      "id": "LM-004",
      "observation": {
        "data": [
          {
            "BaselineResult": "passed",
            "C": "3297214465@'http://127.0.0.1:51185'",
            "Child": "Child",
            "Me": "Me",
            "Parent": "8657489597@'http://127.0.0.1:51185'",
            "S": "6490375539@'http://127.0.0.1:51185'"
          }
        ],
        "more": false,
        "pid": 6490375539,
        "type": "success"
      },
      "status": "pass",
      "title": "Child termination leaves its linked parent alive"
    },
    {
      "duration_ms": 147,
      "id": "LM-005",
      "observation": {
        "data": [
          {
            "BaselineResult": "passed",
            "C": "C",
            "CP": "CP",
            "CR": "7292627391",
            "Child": "7211114847@'http://127.0.0.1:51185'",
            "D": "1792861041.907095",
            "G": "G",
            "GP": "GP",
            "GR": "4614115765",
            "Grand": "1959299838@'http://127.0.0.1:51185'",
            "R": "R",
            "Root": "3387915203@'http://127.0.0.1:51185'",
            "S": "4219964069@'http://127.0.0.1:51185'",
            "T": "1792861039.907095"
          }
        ],
        "more": false,
        "pid": 4219964069,
        "type": "success"
      },
      "status": "pass",
      "title": "A three-generation cascade delivers exact notifications under one deadline"
    },
    {
      "duration_ms": 37,
      "id": "LM-006",
      "observation": {
        "data": [
          {
            "BaselineResult": "passed",
            "Drop": "1960542457",
            "Flush": "2581888938",
            "Keep": "5295098490",
            "Other": "7268014658",
            "P": "1577770127@'http://127.0.0.1:51185'",
            "Q": "7680786041@'http://127.0.0.1:51185'",
            "S": "3551668385@'http://127.0.0.1:51185'"
          }
        ],
        "more": false,
        "pid": 3551668385,
        "type": "success"
      },
      "status": "pass",
      "title": "Demonitor withdrawal and scoped flush preserve unrelated monitors and messages"
    }
  ],
  "schema_version": 2,
  "scope": "required",
  "started_at": "2026-10-24T16:57:19.731920+00:00",
  "suite": "links-monitors-0.1"
}
